{
  "approvals": {
    "records": [
      {
        "approver": "Synthetic client owner",
        "class": "C",
        "dependsOnTruth": [
          "business-purpose"
        ],
        "id": "content-approval",
        "minimumClass": "C",
        "state": "APPROVED",
        "subject": "Public website content"
      },
      {
        "approver": null,
        "class": "D",
        "dependsOnTruth": [],
        "id": "production-owner-approval",
        "minimumClass": "D",
        "state": "PENDING",
        "subject": "Production promotion"
      }
    ]
  },
  "authorizations": {
    "records": [
      {
        "approver": "Synthetic client owner",
        "category": "PUBLIC_DISPLAY",
        "dateRef": "fixture-approval",
        "id": "public-site",
        "scope": "Synthetic public website",
        "state": "APPROVED"
      }
    ]
  },
  "changes": {
    "records": [
      {
        "affectedMilestone": "Content review",
        "approvalRequirement": "B",
        "classification": "CONTENT_REVISION",
        "description": "Clarify the service summary.",
        "id": "initial-copy",
        "requestedBy": "Synthetic client owner",
        "scopeImpact": "No scope impact",
        "status": "VERIFIED"
      }
    ]
  },
  "integrations": {
    "records": [
      {
        "category": "Inquiry transport",
        "collectsData": true,
        "dataClassification": "Basic contact PII",
        "environmentHandling": "Separate scoped variables for Preview and Production",
        "environments": [
          "PREVIEW",
          "PRODUCTION"
        ],
        "failureBehavior": "Preserve the submitted state and show a useful error.",
        "fallback": "Provide a client-approved alternate contact path.",
        "id": "contact-webhook",
        "operationalContact": "Synthetic client operations",
        "owner": "Shared operations",
        "ownerApprovalRef": null,
        "provider": "GENERIC_HTTP",
        "purpose": "Deliver inquiry data to the client workflow.",
        "recurringCost": false,
        "requiresSecrets": true,
        "supportLevel": "FIRST_CLASS_CONTRACT",
        "verificationState": "PASS"
      }
    ]
  },
  "project": {
    "actions": [
      {
        "approvalClass": "D",
        "id": "production-promotion",
        "type": "PRODUCTION_PROMOTION"
      }
    ],
    "audiences": {
      "primary": "Owners seeking focused operational advice",
      "secondary": [
        "Referral partners"
      ]
    },
    "delivery": {
      "lifecycleStage": "QA",
      "requiredApprovalIds": [
        "content-approval"
      ],
      "targetLaunchDate": null,
      "tier": "ESSENTIAL_PRESENCE"
    },
    "experience": {
      "amplification": "A1",
      "emotionalGoals": [
        "Confidence",
        "clarity"
      ],
      "principles": [
        "Restrained",
        "direct",
        "evidence-led"
      ],
      "requiredRenderingTechnology": null,
      "responsiveExpectations": [
        "Editorial hierarchy remains clear at every width"
      ]
    },
    "identity": {
      "organization": "Northstar Advisory LLC",
      "projectId": "northstar-advisory",
      "projectName": "Northstar Advisory",
      "projectType": "Professional services website",
      "publicUrl": "https://example.invalid",
      "repositoryContext": "Synthetic WDS fixture only"
    },
    "objectives": {
      "primary": "Establish a clear and credible professional presence.",
      "successCriteria": [
        "Visitors understand the offer",
        "Qualified visitors can inquire"
      ],
      "supporting": [
        "Explain the advisory process",
        "Provide a direct inquiry path"
      ]
    },
    "operations": {
      "hosting": "Managed platform hosting",
      "responsibilities": [
        {
          "area": "DEPLOYMENT",
          "owner": "EXTERNAL_PROVIDER"
        },
        {
          "area": "DOMAIN_DNS",
          "owner": "CLIENT"
        },
        {
          "area": "CONTENT",
          "owner": "CLIENT"
        },
        {
          "area": "INTEGRATIONS",
          "owner": "SHARED"
        },
        {
          "area": "MONITORING",
          "owner": "CLIENT"
        },
        {
          "area": "MAINTENANCE",
          "owner": "CLIENT"
        },
        {
          "area": "ONGOING_DEVELOPMENT",
          "owner": "SHARED"
        }
      ]
    },
    "risk": {
      "flags": [
        "PII"
      ],
      "level": "LOW",
      "requiredReviews": [
        "privacy review"
      ]
    },
    "routes": {
      "protected": [],
      "public": [
        {
          "kind": "STANDARD",
          "path": "/",
          "publicationState": "PUBLISHED",
          "sitemapEligible": true,
          "truthRefs": [
            "business-purpose"
          ]
        },
        {
          "kind": "STANDARD",
          "path": "/services",
          "publicationState": "PUBLISHED",
          "sitemapEligible": true,
          "truthRefs": [
            "business-purpose"
          ]
        },
        {
          "kind": "STANDARD",
          "path": "/contact",
          "publicationState": "PUBLISHED",
          "sitemapEligible": true,
          "truthRefs": []
        }
      ],
      "redirects": []
    },
    "schemaVersion": "1.0.0"
  },
  "qa": {
    "accessibilityRequirements": [
      "Keyboard operability",
      "Visible focus",
      "Reduced motion"
    ],
    "allowDocumentedNonBlockers": true,
    "browsers": [
      {
        "browser": "CHROMIUM",
        "id": "chromium-desktop",
        "mode": "desktop",
        "reason": null,
        "state": "PASS"
      },
      {
        "browser": "CHROMIUM",
        "id": "chromium-responsive",
        "mode": "responsive",
        "reason": null,
        "state": "PASS"
      },
      {
        "browser": "SAFARI",
        "id": "safari-desktop",
        "mode": "desktop",
        "reason": null,
        "state": "PASS"
      }
    ],
    "contentIntegrity": true,
    "criticalRiskOverrideApprovalRef": null,
    "gates": [
      {
        "category": "TYPECHECK",
        "id": "typecheck",
        "state": "PASS"
      },
      {
        "category": "LINT",
        "id": "lint",
        "state": "PASS"
      },
      {
        "category": "BUILD",
        "id": "build",
        "state": "PASS"
      },
      {
        "category": "DEPENDENCY_AUDIT",
        "id": "dependency-audit",
        "state": "PASS"
      },
      {
        "category": "RESPONSIVE",
        "id": "responsive",
        "state": "PASS"
      },
      {
        "category": "CONTENT_INTEGRITY",
        "id": "content-integrity",
        "state": "PASS"
      },
      {
        "category": "ACCESSIBILITY",
        "id": "accessibility",
        "state": "PASS"
      },
      {
        "category": "BROKEN_LINKS",
        "id": "broken-links",
        "state": "PASS"
      },
      {
        "category": "METADATA",
        "id": "metadata",
        "state": "PASS"
      },
      {
        "category": "SECURITY",
        "id": "security",
        "state": "PASS"
      }
    ],
    "releaseCertificationRequired": false,
    "requiredBrowserIds": [
      "chromium-desktop",
      "chromium-responsive",
      "safari-desktop"
    ],
    "requiredGateIds": [
      "typecheck",
      "lint",
      "build",
      "dependency-audit",
      "responsive",
      "content-integrity",
      "accessibility",
      "broken-links",
      "metadata",
      "security"
    ],
    "responsiveMatrix": [
      360,
      768,
      1280
    ]
  },
  "truth": {
    "records": [
      {
        "approver": "Synthetic client owner",
        "id": "business-purpose",
        "notes": "Fictional fixture statement",
        "publicEligible": true,
        "sourceRef": "docs/project-brief.md",
        "state": "CLIENT-PROVIDED",
        "statement": "The fictional firm provides operational advisory services.",
        "subject": "Organization purpose"
      }
    ]
  }
}
